{
  "schemaVersion": "1.0",
  "manifestId": "f718dd34-e9c1-5b16-b049-d952c0acc158",
  "sequence": 2,
  "kind": "correction",
  "previousManifestId": "4f6e516e-d171-55f7-9a4b-801fa6c8fe5d",
  "network": {
    "id": "9e3bdf6e-d535-5b73-980a-b83006adb65d",
    "slug": "relay-demo"
  },
  "show": {
    "id": "b3574351-38e3-5000-9fb9-3083dfe3714f",
    "podcastGuid": "23913e19-7579-5cfe-a87c-43f1f2d78428",
    "slug": "signal-garden"
  },
  "episode": {
    "id": "d54760b5-9c2a-5fff-b1f0-1513cd1e7cac",
    "guid": "4435f3ab-f113-5cc9-9880-a58def9b191a"
  },
  "revision": {
    "id": "9598a15d-6eea-5ce9-bfd8-e53b7861e2dd",
    "number": 3
  },
  "access": {
    "accessClass": "public",
    "edition": "standard"
  },
  "originalPublishedAt": "2026-10-05T09:00:00Z",
  "effectiveAt": "2026-10-07T12:00:00Z",
  "scheduleGeneration": 1,
  "metadata": {
    "episode": {
      "title": "Tide Pools at Dawn",
      "summary": "A walk along the fictional Signal Garden coast.",
      "notesHtml": "<p>Mara and Dev walk the tide pools of the fictional Signal Garden coast.</p>",
      "notesSha256": "54fac761b256534203e5de5b5003777ffb48749d6224b9c59b68365efb3c7666",
      "episodeType": "full",
      "seasonNumber": 1,
      "episodeNumber": 1,
      "explicit": false,
      "language": "en",
      "link": "https://relay.test/shows/signal-garden/tide-pools-at-dawn",
      "persons": [
        {
          "personId": "328a7ada-8eb4-5af6-9244-baded6143f4f",
          "name": "Mara Quill",
          "role": "host"
        },
        {
          "personId": "052dcd15-9f1c-584a-9bd4-3b596e87e97f",
          "name": "Dev Okafor",
          "role": "guest",
          "href": "https://relay.test/people/dev-okafor"
        }
      ],
      "topics": ["nature", "field-recording"],
      "imageAssetId": "30a93a95-e252-5c7c-9609-f6df71724df2"
    },
    "show": {
      "title": "Signal Garden",
      "author": "Relay Demo Network",
      "language": "en",
      "explicit": false,
      "categories": [
        {
          "name": "Science",
          "subcategory": "Nature"
        }
      ],
      "link": "https://relay.test/shows/signal-garden",
      "feedUrl": "https://feeds.relay.test/signal-garden.xml",
      "imageUrl": "https://media.relay.test/a/7a5b3315-4c5b-59a4-86e7-7676bb8eb976/signal-garden-3000.jpg",
      "copyright": "CC BY 4.0 Relay Demo Network"
    }
  },
  "enclosure": {
    "assetId": "de0a8b21-c7f2-5c6a-8d78-bcb628d48bc4",
    "url": "https://media.relay.test/a/de0a8b21-c7f2-5c6a-8d78-bcb628d48bc4/tide-pools-at-dawn.mp3",
    "length": 28305000,
    "mime": "audio/mpeg"
  },
  "assets": [
    {
      "assetId": "de0a8b21-c7f2-5c6a-8d78-bcb628d48bc4",
      "lineageId": "9dfb151f-320f-5608-97b3-5cb3bf6bd1b7",
      "version": 2,
      "role": "rendition",
      "format": "mp3",
      "edition": "standard",
      "mime": "audio/mpeg",
      "bytes": 28305000,
      "sha256": "edd4a3e853e924a3997b0d4a5fd7d5f55c9cc0c06d623c4ec92dcc084f91b9ae",
      "url": "https://media.relay.test/a/de0a8b21-c7f2-5c6a-8d78-bcb628d48bc4/tide-pools-at-dawn.mp3",
      "sourceAssetId": "7274062c-5b56-5a24-a99b-42b4fe8cc94b",
      "durationMs": 1769000,
      "bitrateKbps": 128
    },
    {
      "assetId": "82fb21cf-47d7-5ae5-87f2-6534e190f92d",
      "lineageId": "6dfe5257-83fa-50f6-a675-eb6ed3ed36d7",
      "version": 1,
      "role": "rendition",
      "format": "hls_master",
      "edition": "standard",
      "mime": "application/vnd.apple.mpegurl",
      "bytes": 912,
      "sha256": "d8afc14e700dfd8629ea3a029040a2c2d839a5af9a442e2b9d16b50e164c8cea",
      "url": "https://media.relay.test/a/82fb21cf-47d7-5ae5-87f2-6534e190f92d/master.m3u8",
      "sourceAssetId": "3d5f29d9-a4ea-5e11-b571-261dd2d1ac35",
      "durationMs": 1769000,
      "width": 1920,
      "height": 1080
    },
    {
      "assetId": "df05c896-b95a-56b1-8849-7dbaab939be5",
      "lineageId": "f94af3bc-8716-5e86-bd4d-d1e413543f31",
      "version": 1,
      "role": "transcript",
      "format": "podcast_json",
      "edition": "standard",
      "mime": "application/json",
      "bytes": 48213,
      "sha256": "29ccc85d812c2004e2557d4aaa2b973aaad57eab11ff7c9819185e60fa3fb4f3",
      "url": "https://media.relay.test/a/df05c896-b95a-56b1-8849-7dbaab939be5/transcript.json",
      "language": "en"
    },
    {
      "assetId": "515a2c76-8791-58cf-b343-be88f7a862c3",
      "lineageId": "515a2c76-8791-58cf-b343-be88f7a862c3",
      "version": 1,
      "role": "caption",
      "format": "webvtt",
      "edition": "standard",
      "mime": "text/vtt",
      "bytes": 39110,
      "sha256": "78cd00835041003fe6850f8c5879dca22843b11e3373198a27883a087bea7dbc",
      "url": "https://media.relay.test/a/515a2c76-8791-58cf-b343-be88f7a862c3/captions.en.vtt",
      "language": "en"
    },
    {
      "assetId": "765f43b2-39e6-5de8-ae84-43c083832f60",
      "lineageId": "dea1f2ba-db6e-58b7-ac0c-ef1256ba6af3",
      "version": 1,
      "role": "chapters",
      "format": "podcast_chapters_json",
      "edition": "standard",
      "mime": "application/json+chapters",
      "bytes": 1204,
      "sha256": "343677762813eaeb65704cc8d9e96f7a444ba0cca92ff861af7f68648b3e6ef1",
      "url": "https://media.relay.test/a/765f43b2-39e6-5de8-ae84-43c083832f60/chapters.json"
    },
    {
      "assetId": "30a93a95-e252-5c7c-9609-f6df71724df2",
      "lineageId": "96f0dce3-96bb-505f-8c62-fd3817dfe8b8",
      "version": 1,
      "role": "artwork",
      "format": "jpeg",
      "edition": "standard",
      "mime": "image/jpeg",
      "bytes": 512000,
      "sha256": "d3cec99112255db9bf4963f7798562b6a36f1bd0b2016918629e007d474deb70",
      "url": "https://media.relay.test/a/30a93a95-e252-5c7c-9609-f6df71724df2/cover-3000.jpg",
      "width": 3000,
      "height": 3000
    }
  ],
  "transcript": {
    "revisionId": "f8dd8e9d-564e-57c9-af5d-04c8e1170c71",
    "source": "whisper",
    "language": "en",
    "approvalId": "f7b7e1d9-936e-5361-9428-9cd5e04d6efa",
    "assetIds": ["df05c896-b95a-56b1-8849-7dbaab939be5", "515a2c76-8791-58cf-b343-be88f7a862c3"]
  },
  "chapters": {
    "chapterSetId": "9399a8a8-6c17-5729-8b96-4e8af99d9e3c",
    "version": 1,
    "approvalId": "585b388d-8ef7-572c-ab48-c5a413f621d4",
    "assetId": "765f43b2-39e6-5de8-ae84-43c083832f60"
  },
  "rights": [
    {
      "rightsRecordId": "430030ce-d0a5-525d-b8cd-df72f4f364b5",
      "subject": "license",
      "license": "CC-BY-4.0",
      "attribution": "Relay Demo Network"
    }
  ],
  "approvals": [
    {
      "approvalId": "000d77f9-d0e2-5f1c-9923-2eb88f3c7560",
      "subjectType": "episode_revision",
      "subjectId": "9598a15d-6eea-5ce9-bfd8-e53b7861e2dd",
      "approverId": "0648876a-e536-5265-8574-3b739cb5b45b",
      "approvedAt": "2026-10-07T11:40:00Z"
    },
    {
      "approvalId": "f7b7e1d9-936e-5361-9428-9cd5e04d6efa",
      "subjectType": "transcript_revision",
      "subjectId": "f8dd8e9d-564e-57c9-af5d-04c8e1170c71",
      "approverId": "0648876a-e536-5265-8574-3b739cb5b45b",
      "approvedAt": "2026-10-07T11:30:00Z"
    },
    {
      "approvalId": "585b388d-8ef7-572c-ab48-c5a413f621d4",
      "subjectType": "chapter_set",
      "subjectId": "9399a8a8-6c17-5729-8b96-4e8af99d9e3c",
      "approverId": "812c5c48-c9af-5a3f-9025-dc306492ed0c",
      "approvedAt": "2026-10-07T11:35:00Z"
    },
    {
      "approvalId": "0f283b97-5e3a-56dc-905c-e77c92fe4dbb",
      "subjectType": "rights_record",
      "subjectId": "430030ce-d0a5-525d-b8cd-df72f4f364b5",
      "approverId": "812c5c48-c9af-5a3f-9025-dc306492ed0c",
      "approvedAt": "2026-09-30T10:00:00Z"
    }
  ],
  "createdAt": "2026-10-07T12:00:00Z",
  "createdBy": {
    "actorType": "staff",
    "actorId": "0648876a-e536-5265-8574-3b739cb5b45b"
  }
}
